{
  "$schema": "./versions.schema.json",
  "tool": "ledger",
  "description": "CodeAtlas Living Architecture Ledger CLI",
  "repository": "https://github.com/mauricecarrier7/CodeAtlas",
  "latest": "0.9.7",
  "minimum_supported": "0.1.0",
  "versions": [
    {
      "version": "0.9.7",
      "release_date": "2026-07-22T00:00:00Z",
      "source_commit": "aa9ef03",
      "swift_version": "6.0",
      "release_notes": "Monolith app-target indexing: real blast-radius on single-target apps; config componentRoots + symbol-ref edges. ledger rebuilt; qaatlas reused from 0.9.6.",
      "artifacts": {
        "macos-arm64": {
          "url": "https://github.com/SyncTek-LLC/ledger-dist/releases/download/v0.9.7/ledger-macos-arm64",
          "sha256": "467ccd3429a1d8aea229a4809fb343499124d665627882da7f1341d8fb4faea7",
          "size_bytes": 30640152
        },
        "qaatlas": {
          "url": "https://github.com/SyncTek-LLC/ledger-dist/releases/download/v0.9.6/qaatlas-macos-arm64",
          "sha256": "60381ffd6946724a14ea4e9e75068b08e88a2d5c314dc89428d1d5be33ff522a",
          "size_bytes": 111183648
        }
      },
      "checksums_url": "https://github.com/SyncTek-LLC/ledger-dist/releases/download/v0.9.7/ledger-macos-arm64.sha256"
    },
    {
      "version": "0.9.6",
      "release_date": "2026-03-31T23:00:00Z",
      "source_commit": "e965bd4",
      "swift_version": "6.0",
      "release_notes": "QAAtlas 2.3.0 coverage accuracy overhaul \u2014 8 fixes for Xcode alignment",
      "artifacts": {
        "macos-arm64": {
          "url": "https://github.com/SyncTek-LLC/ledger-dist/releases/download/v0.9.6/ledger-macos-arm64",
          "sha256": "f7786aba06333cefcf36b39d0feb3ec68c71cd05d3099f9e4cf95a9305c3ee2c",
          "size_bytes": 30744600
        },
        "qaatlas": {
          "url": "https://github.com/SyncTek-LLC/ledger-dist/releases/download/v0.9.6/qaatlas-macos-arm64",
          "sha256": "60381ffd6946724a14ea4e9e75068b08e88a2d5c314dc89428d1d5be33ff522a",
          "size_bytes": 111183648
        }
      },
      "checksums_url": "https://github.com/SyncTek-LLC/ledger-dist/releases/download/v0.9.6/checksums.txt"
    },
    {
      "version": "0.9.4",
      "release_date": "2026-02-03T01:00:00Z",
      "source_commit": "c54ee2a",
      "swift_version": "6.0",
      "release_notes": "CI-compatible binaries: AccessLint bundled, QAAtlas rebuilt with official Node.js",
      "artifacts": {
        "macos-arm64": {
          "url": "https://github.com/mauricecarrier7/ledger-dist/releases/download/v0.9.4/ledger-macos-arm64",
          "sha256": "b2de62a497551c54de921aa282ac8619f8917f888ddfea52469c6fb1cf29eeee",
          "size_bytes": 30567096
        },
        "accesslint": {
          "url": "https://github.com/mauricecarrier7/ledger-dist/releases/download/v0.9.4/accesslint-macos-arm64",
          "sha256": "556e758b777b90a9aa93912d93b6f28aa7104c58a05a06ac99d11a8ea378ce09",
          "size_bytes": 20076792
        },
        "qaatlas": {
          "url": "https://github.com/mauricecarrier7/ledger-dist/releases/download/v0.9.4/qaatlas-macos-arm64",
          "sha256": "f7560ed16dc0c5523313450e271027f89e79be3ca6f5240ae27ca475b469dbfc",
          "size_bytes": 110520928
        }
      },
      "checksums_url": "https://github.com/mauricecarrier7/ledger-dist/releases/download/v0.9.4/checksums.txt"
    },
    {
      "version": "0.9.3",
      "release_date": "2026-02-02T22:30:00Z",
      "source_commit": "c54ee2a",
      "swift_version": "6.0",
      "release_notes": "E2E test script + observe works without init (CI-friendly)",
      "artifacts": {
        "macos-arm64": {
          "url": "https://github.com/mauricecarrier7/ledger-dist/releases/download/v0.9.3/ledger-macos-arm64",
          "sha256": "b2de62a497551c54de921aa282ac8619f8917f888ddfea52469c6fb1cf29eeee",
          "size_bytes": 30567096
        },
        "qaatlas": {
          "url": "https://github.com/mauricecarrier7/ledger-dist/releases/download/v0.9.3/qaatlas-macos-arm64",
          "sha256": "d98bff6ee2973dc28643531fe86dda3358480f53e0d687a0f2b58c29d188929d",
          "size_bytes": 72298992
        }
      },
      "checksums_url": "https://github.com/mauricecarrier7/ledger-dist/releases/download/v0.9.3/checksums.txt"
    },
    {
      "version": "0.9.2",
      "release_date": "2026-02-02T21:25:00Z",
      "source_commit": "f9b53f7",
      "swift_version": "6.0",
      "release_notes": "Fix a11y/qa analyzers to invoke actual binaries - works with all project structures",
      "artifacts": {
        "macos-arm64": {
          "url": "https://github.com/mauricecarrier7/ledger-dist/releases/download/v0.9.2/ledger-macos-arm64",
          "sha256": "9c8bd6129af73e431907b45b70588697d06466e4b5cf31a1b62e2115f4261987",
          "size_bytes": 30567288
        },
        "qaatlas": {
          "url": "https://github.com/mauricecarrier7/ledger-dist/releases/download/v0.9.2/qaatlas-macos-arm64",
          "sha256": "d98bff6ee2973dc28643531fe86dda3358480f53e0d687a0f2b58c29d188929d",
          "size_bytes": 72298992
        }
      },
      "checksums_url": "https://github.com/mauricecarrier7/ledger-dist/releases/download/v0.9.2/checksums.txt"
    },
    {
      "version": "0.9.1",
      "release_date": "2026-02-02T21:13:00Z",
      "source_commit": "4aae5d0",
      "swift_version": "6.0",
      "release_notes": "Bundled QAAtlas binary - zero-config installation for full analysis suite",
      "artifacts": {
        "macos-arm64": {
          "url": "https://github.com/mauricecarrier7/ledger-dist/releases/download/v0.9.1/ledger-macos-arm64",
          "sha256": "da300c26ec7ad3692adb11aff158fece7aab72f21b1f607c55cedec6c006172c",
          "size_bytes": 30547544
        },
        "qaatlas": {
          "url": "https://github.com/mauricecarrier7/ledger-dist/releases/download/v0.9.1/qaatlas-macos-arm64",
          "sha256": "d98bff6ee2973dc28643531fe86dda3358480f53e0d687a0f2b58c29d188929d",
          "size_bytes": 72298992
        }
      },
      "checksums_url": "https://github.com/mauricecarrier7/ledger-dist/releases/download/v0.9.1/checksums.txt"
    },
    {
      "version": "0.9.0",
      "release_date": "2026-02-02T21:03:00Z",
      "source_commit": "49c8353",
      "swift_version": "6.0",
      "release_notes": "Integrated AccessLint & QAAtlas as bundled analyzers - no external binaries required for a11y analysis, unified configuration",
      "artifacts": {
        "macos-arm64": {
          "url": "https://github.com/mauricecarrier7/ledger-dist/releases/download/v0.9.0/ledger-macos-arm64",
          "sha256": "b674f7c2aefb27c0ef733da79a0fbc439c1741e2984031eac67f429d3bf06aa4",
          "size_bytes": 30547544
        }
      },
      "checksums_url": "https://github.com/mauricecarrier7/ledger-dist/releases/download/v0.9.0/ledger-macos-arm64.sha256"
    },
    {
      "version": "0.8.3",
      "release_date": "2026-02-02T19:52:00Z",
      "source_commit": "d68b7eb",
      "swift_version": "6.0",
      "release_notes": "Fix summary.json key names: arch/reach/a11y/qa now match domain names and output directories",
      "artifacts": {
        "macos-arm64": {
          "url": "https://github.com/mauricecarrier7/ledger-dist/releases/download/v0.8.3/ledger-macos-arm64",
          "sha256": "5f7fd026971da052940b34475b6bfde254b6d0dff5d50bbeea5726c239e48019",
          "size_bytes": 30567048
        }
      },
      "checksums_url": "https://github.com/mauricecarrier7/ledger-dist/releases/download/v0.8.3/ledger-macos-arm64.sha256"
    },
    {
      "version": "0.8.2",
      "release_date": "2026-02-02T18:00:00Z",
      "source_commit": "4cdaaa3",
      "swift_version": "6.0",
      "release_notes": "Fix QAAtlas integration - add preset detection for iOS/Swift projects",
      "artifacts": {
        "macos-arm64": {
          "url": "https://github.com/mauricecarrier7/ledger-dist/releases/download/v0.8.2/ledger-macos-arm64",
          "sha256": "b40283d1e5bec356c7369b5167ad4e4ad980877295d4f5dea793cde4edc51826",
          "size_bytes": 30568408
        }
      },
      "checksums_url": "https://github.com/mauricecarrier7/ledger-dist/releases/download/v0.8.2/ledger-macos-arm64.sha256"
    },
    {
      "version": "0.8.1",
      "release_date": "2026-02-02T17:30:00Z",
      "source_commit": "1cdc810",
      "swift_version": "6.0",
      "release_notes": "AccessLint & QAAtlas binary integration: observe command now invokes actual binaries for real findings, proper JSON output for CI PR comments",
      "artifacts": {
        "macos-arm64": {
          "url": "https://github.com/mauricecarrier7/ledger-dist/releases/download/v0.8.1/ledger-macos-arm64",
          "sha256": "0dda637467dc6c0a47e5edd4acf585f2268a4b7c39332d40735682d04ed183c8",
          "size_bytes": 30568040
        }
      },
      "checksums_url": "https://github.com/mauricecarrier7/ledger-dist/releases/download/v0.8.1/ledger-macos-arm64.sha256"
    },
    {
      "version": "0.8.0",
      "release_date": "2026-02-02T16:55:00Z",
      "source_commit": "651401f",
      "swift_version": "6.0",
      "release_notes": "Unified observe command: ledger observe for CI-safe analysis with JSON output (summary.json, arch/analysis.json, a11y/findings.json, qa/gap-report.json, flow/flows.json)",
      "artifacts": {
        "macos-arm64": {
          "url": "https://github.com/mauricecarrier7/ledger-dist/releases/download/v0.8.0/ledger-macos-arm64",
          "sha256": "de404a8083f2a6c1b9522cd7ecbdcd70ef45f64c22b957a2efe53f869232888b",
          "size_bytes": 30549000
        }
      },
      "checksums_url": "https://github.com/mauricecarrier7/ledger-dist/releases/download/v0.8.0/ledger-macos-arm64.sha256"
    },
    {
      "version": "0.7.0",
      "release_date": "2026-02-02T15:49:00Z",
      "source_commit": "16e6df9",
      "swift_version": "6.0",